id,link_to_property,price,size,address,key_features,description,agent_name,agent_address,agent_phone_number
14046104,https://www.onthemarket.com/details/14046104,"£19,950,000",,"The Bishops Avenue, Hampstead, London, N2","1. Tenure: Share of freehold (987 years remaining), 2. Penthouse apartment within this development set on a 2.5 acres with private landscape gardens., 3. Views over playing fields, Kenwood park and beyond., 4. 24/7 security, concierge and maid service., 5. Entertainment area with bar/cinema/games room etc., 6. 6 space private garage, 7. Full leisure facilities accessible to all residents., 8. EPC Rating = D","A spectacular penthouse apartment within the Buxmead development set on a 2.5 acre estate with private landscape gardens.
DescriptionThe apartment offers wrap around terraces with beautiful views over the playing fields, Kenwood park and beyond. A private lift connects to a lower level private dining room, study, bar/cinema/games room with an extremely rare 6 space private garage offering residents complete discretion and the ultimate security. Further benefits include 24/7 security, concierge and maid service.The property is set in extensive landscaped grounds with a pavilion / BBQ area and it is complete with an indoor 25m pool, spa, cinema and full leisure and entertainment facilities accessible to all residents. The residential amenities consume approximately 15,000 sq feet. This apartment has been fully-finished to a very high standard by SHH architects and interior designers and has private lift access to all areas.LocationThe Bishops Avenue in Hampstead is not simply one of the most desirable addresses in prime London, it is also celebrated throughout the world for its magnificent mansions and grand houses. The Bishops Avenue is named after the Bishop Ingram Winnington – The Bishop of London Park, which historically occupied this area. Buxmead is situated moments from Kenwood House, The Heath, and in between equally delightful Hampstead and Highgate villages, both of which offer a wide range of exclusive shops selling artisan goods, boutiques, coffee shops, restaurants, bars, art galleries and more. This local area is also renowned for having a high concentration of London’s top-performing schools with prestigious Highgate School founded in the 15th century within close proximity.Kenwood House, and the part of the Heath which it occupies, offers fantastic views of London, whilst also being close to several golf courses and other open spaces. London’s West End, the City, Knightsbridge and other key areas in Central London are within easy reach. Access to the M1 motorway the A1 and the North Circular (A406). East Finchley and Golders Green underground stations (Northern Line) are close by, and for travel further afield, Heathrow, Luton and London City airports are easily accessible, as well as RAF Northolt, Biggin Hill and Farnborough.Square Footage: 9,677 sq ft

 
Additional InfoAn award-winning collection of three penthouses, six duplexes and eleven lateral apartments set in a 2.5 acre site with private landscaped gardens. Discover effortless living with the Buxmead concierge service and enjoy outstanding facilities including an indoor 25m pool, spa, cinema and more. All just a short stroll from the cafés, shops and green spaces of London’s Hampstead and Highgate.At Buxmead, we take care of day-to-day living so you can enjoy an effortless lifestyle. We’ll do your housekeeping for you and take care of deliveries. Whenever you’re away from home, know we’re looking after your apartment - keeping it secure and preparing your home for when you return. We take care of all the essential things, like changing the light bulbs and cleaning your windows. And we keep an eye on how everything’s running at Buxmead - maintaining and servicing the building. If something feels like a chore, let us do it for you.  The Club Facilities are all yours to enjoy. Swim in the Olympic sprint length indoor pool. Work out in the Technogym. Relax in the spa, cinema, and Residents’ Lounge. Work and host meetings in the business centre. Use the facilities on impulse or to have an area of Buxmead to yourself, make a booking with the Concierge. When you want to host an event, we’ll put a team together to help you manage it.  Entertaining is an effortless experience. Book the Private Dining Room and enjoy fine food with up to eighteen guests. You could even host a special event for a hundred - the Concierge can help to organise catering or entertainment. Even in the daytime, the Residents’ Lounge is available to unwind in. Help yourself to a coffee or ask us to serve your favourite tipple.  Impress your most important clients in the Business Centre; the private offices and lounge are available for you to use. For a larger meeting, reserve the Boardroom - it’s fully-equipped with video-conferencing facilities and secretarial services can be provided on request. Buxmead residents will benefit from a dedicated leased line providing super-fast WIFI - it’s possible to download a DVD in seconds.  Sit back with your favourite film and up to eighteen friends in the cinema. Or challenge someone in the Games Room - there’s PlayStation, table-football, table-tennis and pool. The area is serviced by its own bar and you can play your own playlist through the speakers - if you prefer live music, there’s a piano available. Book via the Concierge or head down at your leisure.  The Olympic sprint-length pool and individual changing rooms can be booked for a private swim or even a sociable splash with friends. Relax in the Jacuzzi or head to the sauna, hammam or steam room instead. Have a massage in the dedicated massage room with professional table or head to the professional salon for hair dressing and manicure - the treatment rooms are available for you to pamper in privacy.  Overlook the swimming pool while you do weights, improve your cardio or try Pilates in the gym. At Buxmead, you have access to state-of-the-art Technogym equipment that links seamlessly with your tablet and mobile phone. Speak to your concierge about booking a personal trainer, masseur or nutritionist from local experts All About You.",Savills - St John's Wood & Regent's Park,15 St John's Wood High Street St John's Wood NW8 7NG,020 8022 7387
15736063,https://www.onthemarket.com/details/15736063,"£16,000,000","4,843 sq ft / 450 sq m","Eaton Place, London, SW1X"",""agent"":{""branch_id"":22373,""name"":""Savills - Sloane Street"",""contact-url"":""/agents/contact/13293755/?form-name=details-contact"",""appraisal-url"":""/agents/contact/13293755/?appraisal=true&form-name=details-appraisal"",""display-logo"":{""url"":""https://media.onthemarket.com/agents/companies/4/161109164034707/logo-100x65.png"",""height"":65,""width"":65,""resized?"":true},""logo"":{""geometries"":{""300x200"":{""w"":200,""bound-y"":200,""h"":200,""url"":""agents/companies/4/161109164034707/logo-300x200.png"",""bound-x"":300},""190x100"":{""w"":100,""bound-y"":100,""h"":100,""url"":""agents/companies/4/161109164034707/logo-190x100.png"",""bound-x"":190},""100x65"":{""w"":65,""bound-y"":65,""h"":65,""url"":""agents/companies/4/161109164034707/logo-100x65.png"",""bound-x"":100},""290x55"":{""w"":55,""bound-y"":55,""h"":55,""url"":""agents/companies/4/161109164034707/logo-290x55.png"",""bound-x"":290}}},""logo-path"":""/agents/companies/4/161109164034707/logo-original.png""},""property-title"":""4 bedroom end of terrace house for sale"",""price-coming-soon?"":false,""bedrooms"":4,""id"":""13293755"",""spotlight?"":false,""bathrooms"":0,""property-link"":""/details/13293755/"",""recently-added?"":false,""exclusive?"":false,""cover-image"":{""default"":""https://media.onthemarket.com/properties/13293755/1447507079/image-0-480x320.jpg"",""portrait?"":false,""webp"":""https://media.onthemarket.com/properties/13293755/1447507079/image-0-480x320.webp""},""price"":""£17,500,000""}],""display_address"":""Eaton Mews South, London, SW1W","1. Tenure: Freehold, 2. Newly constructed within the last decade, 3. Double width mews house, 4. 4 reception rooms, 5. 3 4 bedroom suites, 6. Landscaped roof garden, 7. Lift, 8. EPC Rating = C","This exceptional 3-4 bedroom double width mews house was reconstructed in its entirety approx 10 years ago and offers superb lateral living on four floors, all of which are served by a lift.
DescriptionThe house has a very good balance of living and bedroom accommodation with all rooms being of a good size and benefitting from an abundance of natural light. In addition, the house has an impressive double height entrance hall, a good size garage, a lovely landscaped roof garden, a study and a well-appointed cinema/media room.Furthermore, the house benefits from air cooling and home automation throughout.LocationSituated in highly desirable Belgravia, Eaton Mews South is a sought-after address, located approximately 0.2 miles away from the charming shops, restaurants, and cafes of Elizabeth Street and approximately 0.4 miles from Victoria Station, offering access to underground and Overground rail services on the Circle, District, and Victoria Lines.Square Footage: 4,724 sq ft",Savills - Sloane Street,"139 Sloane Street, Sloane Square Knightsbridge SW1X 9AY",020 8022 6951
11847676,https://www.onthemarket.com/details/11847676,"£15,500,000","9,439 sq ft / 877 sq m","Winnington Road, Hampstead, London, N2","1. Tenure: Freehold, 2. New build mansion 10,500 sq ft, 3. 5 reception rooms, 4. 8 bedroom suites, 5. Leisure complex, 6. Cinema/media room, 7. Garden, 8. Double garage, 9. Driveway, 10. EPC rating=C, 11. EPC Rating = C","A new mansion of approximately 10,000 sq ft (929 sq m) designed and finished to an exemplary standard incorporating every conceivable facility and luxury.
DescriptionA newly built mansion of approximately 10,833 sq ft (1,006.4 sq m) designed and finished to an exemplary standard incorporating every conceivable facility and luxury.An impressive newly built mansion of approximately 10,000 sq ft (929 sq m) situated in the heart of one of the area's most sought after locations.  Set behind a sweeping carriage driveway, this beautiful home incorporates some of the finest bespoke fittings, together with state of the art technology, including air conditioning and under floor heating. The property also incorporates an incredible leisure complex including a large swimming pool, a gymnasium and a steam room.  Other facilities include a fully equipped cinema/media room, a full air conditioning system together with under floor heating throughout.Drawing room, family room, dining room, study/home office, Schiffini kitchen with Gaggenau Appliances, elegant triple height entrance hall, master bedroom suite with his and hers dressing rooms, 6 further bedroom suites, staff accommodation/bedroom 8 with en suite shower room, leisure complex which includes a steam room, gymnasium, reception hall and a swimming pool, fully equipped cinema and media room, service/staff kitchen, utility room, double garage, off-street parking, landscaped front and rear gardens with a full irrigation system.LocationWinnington Road is highly desirable and is parallel to The Bishop's Avenue. Hampstead Golf course backs onto Winnington Road and Highgate Golf course is just over one mile away. Hampstead Heath and Kenwood can be found off Hampstead Lane close to it's junction with Winnington Road. Baker Street and London's West End is approximately 4 miles distant.Square Footage: 10,086 sq ft

 
Additional InfoCouncil Tax Band: H",Savills - Hampstead,7 Perrin's Court Hampstead NW3 1QS,020 8022 7310
15719873,https://www.onthemarket.com/details/15719873,"£17,950,000",,"Wilton Crescent, London SW1X",1. Tenure: Freehold,"A beautiful and sophisticated FREEHOLD town house, 5564 sq ft / 517 sq m approximately, with glorious and voluminous reception rooms, situated in a very tranquil and set back position in this ultra prime Belgravia location. There are fabulous views from all the principal rooms over the Crescent gardens towards Knightsbridge in the far distance.This is a wonderful house for entertaining as the accommodation includes a vast DOUBLE DRAWING ROOM with 4 metre ceiling heights and a large dining room. In addition there is a matched pair of equally proportioned principal suites and 3-4 further bedrooms. There is air-conditioning to the upper floors.Wilton Crescent is unquestionably the preferred, pre-eminent address for Belgravia town houses.",Jeremy Davidson Property Consultants - Belgravia,Margaretta Terrace SW3 5NU,020 8022 5564
12972099,https://www.onthemarket.com/details/12972099,"£15,500,000","10,086 sq ft / 937 sq m","Winnington Road, N2","1. Tenure: Freehold, 2. Reception hall, 3. Drawing room, 4. Sitting room, 5. Dining room, 6. Kitchen/breakfast room: study, 7. Principal bedroom with his and hers en suites and dressing rooms, 8. 7 further bedrooms with en suites, 9. Guest wc: cloakroom, 10. Garage: rear garden, 11. Off street parking","A new mansion of approximately 10,000 sq ft (929 sq m) designed and finished to an exemplary standard incorporating every conceivable facility and luxury.This impressive newly built mansion for sale  is situated in the heart of one of the area's most sought after locations. Set behind a sweeping carriage driveway, this beautiful home incorporates some of the finest bespoke fittings, together with state of the art technology, including air conditioning and under floor heating. The property also incorporates an incredible leisure complex including a large swimming pool, a gymnasium and a steam room. Other facilities include a fully equipped cinema/media room, a full air conditioning system together with under floor heating throughout.Drawing room, family room, dining room, study/home office, Schiffini kitchen with Gaggenau Appliances, elegant triple height entrance hall, master bedroom suite with his and hers dressing rooms, 6 further bedroom suites, staff accommodation/bedroom 8 with en suite shower room, leisure complex which includes a steam room, gymnasium, reception hall and a swimming pool, fully equipped cinema and media room, service/staff kitchen, utility room, double garage, off-street parking, landscaped front and rear gardens with a full irrigation system.This house for sale on Winnington Road is the epitome of luxury living. With its incredible facilities and bespoke fittings, this property offers an unparalleled level of comfort and sophistication. Get in touch with Glentree right now to set up a viewing of this magnificent London property that is currently on the market.Rear Ext - Cinema - Garden -",Glentree Estates - London,698 Finchley Road London NW11 7NE,020 8022 6656
15713171,https://www.onthemarket.com/details/15713171,"£15,950,000","3,667 sq ft / 341 sq m","Knightsbridge Gate, London SW1X",,"United Kingdom Sotheby’s International Realty is thrilled to present this exquisite four-bedroom apartment in Knightsbridge Gate. The Grade-II listed Edwardian building was built in 1902 and has recently been the subject of a total renovation. Now fitted with the highest quality, natural materials, including Vietnamese and Calacatta oro polished marble, rich oak, refurbished original timber sash windows and bronze ironmongery, the home successfully honours the grand legacy of the building, but has been updated to ensure ultimate comfort. 

To ensure peace of mind there is a built-in intruder alarm and video intercom system. There is also central heating and cooling, underfloor heating and Lutron lighting. Internally, a rich palette of materials, colours and textures creates a feeling of serenity and a luxurious ambience.

The apartment features a large drawing room with multiple windows, flooding the space with natural light. The kitchen is fully equipped with Gaggenau appliances, ample built-in storage, and a sleek breakfast bar, finished in cosmic black granite. Situated next to it is the formal dining room that is perfect for those who love to entertain. The impressive principal bedroom has a generously proportioned dressing room and a private terrace. The additional three bedrooms each benefit from an en suite; there is also a laundry room with Miele appliances. 

Located in one of the most sought-after areas in London, moments from Hyde Park, Harrods and Harvey Nichols as well as an abundance of restaurants, everything you need is practically on your doorstep.",United Kingdom Sotheby's International Realty - Mayfair,"48 Conduit Street Mayfair, London W1S 2YR",020 8022 3916